{
  "GET /api/currentUser": {
    "res": {
      "data": {
        "name": "Serati Ma",
        "avatar": "https://gw.alipayobjects.com/zos/rmsportal/BiazfanxmamNRoxxVxka.png",
        "userid": "00000001",
        "email": "antdesign@alipay.com",
        "signature": "The sea is tolerant to all rivers, and tolerance is great",
        "title": "interaction expert",
        "group": "Ant Financial - XX Business Group - XX Platform Department - XX Technology Department - UED",
        "tags": [
          {
            "key": "0",
            "label": "very thoughtful"
          },
          {
            "key": "1",
            "label": "Focus on design"
          },
          {
            "key": "2",
            "label": "spicy"
          },
          {
            "key": "3",
            "label": "long legs"
          },
          {
            "key": "4",
            "label": "Chuanmeizi"
          },
          {
            "key": "5",
            "label": "Inclusive of all rivers"
          }
        ],
        "notifyCount": 12,
        "unreadCount": 11,
        "country": "Nepal",
        "geographic": {
          "province": {
            "label": "Bagmati",
            "key": "330000"
          },
          "city": {
            "label": "Patan",
            "key": "330100"
          }
        },
        "address": "Bagdole-4, Lalitpur",
        "phone": "9851184989"
      }
    },
    "query": {
      "token ": " 123"
    },
    "payload": {},
    "types": "/** GET /api/currentUser */\nexport type GET_API_CURRENT_USER_QUERY = {\n  /** example:  123 */\n        token : string\n}\n  \n\nexport type GET_API_CURRENT_USER_PAYLOAD = {\n  \n}\n  \n\nexport type GET_API_CURRENT_USER_RES = {\n  /** example: {\"name\": \"Serati Ma\", \"avatar\": \"https: //gw.alipayobjects.com/zos/rmsportal/BiazfanxmamNRoxxVxka.png\", \"userid\": \"00000001\", \"email\": \"antdesign@alipay.com\", \"signature\": \"Be tolerant to diversity, tolerance is a virtue\", \"title\": \"interaction expert\", \"group\": \"Ant Financial - XX business group - XX platform department - XX technology department - UED\", \"tags\": [{\"key\": \"0\", \"label\": \"very thoughtful\"}, {\"key\": \"1\", \"label\": \"Focus on design\"}, {\"key\": \"2\", \"label\": \"spice\"}, {\"key\": \"3\", \"label\": \"long legs\"}, {\"key\": \"4\", \"label\": \"Chuanmeizi\"}, {\"key\": \"5\", \"label\": \"Inclusive of all rivers\"}], \"notifyCount\": 12, \"unreadCount\": 11, \"country\": \"China\", \"geographic\": {\"province\": {\"label\": \"Bagmati\", \"key\": \"330000\"}, \"city\": {\"label\": \"Patan\", \"key\": \"330100\"}}, \"address\": \"Bagdole=4,Lalitpur\", \"phone\": \"9851184989\"} */\n        data: {\n      name: string,\navatar: string,\nuserid: string,\nemail: string,\nsignature: string,\ntitle: string,\ngroup: string,\ntags: {\n      key: string,\nlabel: string\n      }[],\nnotifyCount: number,\nunreadCount: number,\ncountry: string,\ngeographic: {\n      province: {\n      label: string,\nkey: string\n      },\ncity: {\n      label: string,\nkey: string\n      }\n      },\naddress: string,\nphone: string\n      }\n}\n  "
  },
  "GET /api/rule": {
    "res": {
      "data": [
        {
          "key": 99,
          "disabled": false,
          "href": "https://ant.design",
          "avatar": "https://gw.alipayobjects.com/zos/rmsportal/udxAbMEhpwthVVcjLXik.png",
          "name": "TradeCode 99",
          "owner": "Kalash",
          "desc": "This is description",
          "callNo": 503,
          "status": "0",
          "updatedAt": "2022-12-06T05:00:57.040Z",
          "createdAt": "2022-12-06T05:00:57.040Z",
          "progress": 81
        },
        {
          "key": 98,
          "disabled": false,
          "href": "https://ant.design",
          "avatar": "https://gw.alipayobjects.com/zos/rmsportal/eeHMaZBwmTvLdIwMfBpg.png",
          "name": "TradeCode 98",
          "owner": "Kalash",
          "desc": "This is description",
          "callNo": 164,
          "status": "0",
          "updatedAt": "2022-12-06T05:00:57.040Z",
          "createdAt": "2022-12-06T05:00:57.040Z",
          "progress": 12
        },
        {
          "key": 97,
          "disabled": false,
          "href": "https://ant.design",
          "avatar": "https://gw.alipayobjects.com/zos/rmsportal/udxAbMEhpwthVVcjLXik.png",
          "name": "TradeCode 97",
          "owner": "Kalash",
          "desc": "This is description",
          "callNo": 174,
          "status": "1",
          "updatedAt": "2022-12-06T05:00:57.040Z",
          "createdAt": "2022-12-06T05:00:57.040Z",
          "progress": 81
        },
        {
          "key": 96,
          "disabled": true,
          "href": "https://ant.design",
          "avatar": "https://gw.alipayobjects.com/zos/rmsportal/eeHMaZBwmTvLdIwMfBpg.png",
          "name": "TradeCode 96",
          "owner": "Kalash",
          "desc": "This is description",
          "callNo": 914,
          "status": "0",
          "updatedAt": "2022-12-06T05:00:57.040Z",
          "createdAt": "2022-12-06T05:00:57.040Z",
          "progress": 7
        },
        {
          "key": 95,
          "disabled": false,
          "href": "https://ant.design",
          "avatar": "https://gw.alipayobjects.com/zos/rmsportal/udxAbMEhpwthVVcjLXik.png",
          "name": "TradeCode 95",
          "owner": "Kalash",
          "desc": "This is description",
          "callNo": 698,
          "status": "2",
          "updatedAt": "2022-12-06T05:00:57.040Z",
          "createdAt": "2022-12-06T05:00:57.040Z",
          "progress": 82
        },
        {
          "key": 94,
          "disabled": false,
          "href": "https://ant.design",
          "avatar": "https://gw.alipayobjects.com/zos/rmsportal/eeHMaZBwmTvLdIwMfBpg.png",
          "name": "TradeCode 94",
          "owner": "Kalash",
          "desc": "This is description",
          "callNo": 488,
          "status": "1",
          "updatedAt": "2022-12-06T05:00:57.040Z",
          "createdAt": "2022-12-06T05:00:57.040Z",
          "progress": 14
        },
        {
          "key": 93,
          "disabled": false,
          "href": "https://ant.design",
          "avatar": "https://gw.alipayobjects.com/zos/rmsportal/udxAbMEhpwthVVcjLXik.png",
          "name": "TradeCode 93",
          "owner": "Kalash",
          "desc": "This is description",
          "callNo": 580,
          "status": "2",
          "updatedAt": "2022-12-06T05:00:57.040Z",
          "createdAt": "2022-12-06T05:00:57.040Z",
          "progress": 77
        },
        {
          "key": 92,
          "disabled": false,
          "href": "https://ant.design",
          "avatar": "https://gw.alipayobjects.com/zos/rmsportal/eeHMaZBwmTvLdIwMfBpg.png",
          "name": "TradeCode 92",
          "owner": "Kalash",
          "desc": "This is description",
          "callNo": 244,
          "status": "3",
          "updatedAt": "2022-12-06T05:00:57.040Z",
          "createdAt": "2022-12-06T05:00:57.040Z",
          "progress": 58
        },
        {
          "key": 91,
          "disabled": false,
          "href": "https://ant.design",
          "avatar": "https://gw.alipayobjects.com/zos/rmsportal/udxAbMEhpwthVVcjLXik.png",
          "name": "TradeCode 91",
          "owner": "Kalash",
          "desc": "This is description",
          "callNo": 959,
          "status": "0",
          "updatedAt": "2022-12-06T05:00:57.040Z",
          "createdAt": "2022-12-06T05:00:57.040Z",
          "progress": 66
        },
        {
          "key": 90,
          "disabled": true,
          "href": "https://ant.design",
          "avatar": "https://gw.alipayobjects.com/zos/rmsportal/eeHMaZBwmTvLdIwMfBpg.png",
          "name": "TradeCode 90",
          "owner": "Kalash",
          "desc": "This is description",
          "callNo": 958,
          "status": "0",
          "updatedAt": "2022-12-06T05:00:57.040Z",
          "createdAt": "2022-12-06T05:00:57.040Z",
          "progress": 72
        },
        {
          "key": 89,
          "disabled": false,
          "href": "https://ant.design",
          "avatar": "https://gw.alipayobjects.com/zos/rmsportal/udxAbMEhpwthVVcjLXik.png",
          "name": "TradeCode 89",
          "owner": "Kalash",
          "desc": "This is description",
          "callNo": 301,
          "status": "2",
          "updatedAt": "2022-12-06T05:00:57.040Z",
          "createdAt": "2022-12-06T05:00:57.040Z",
          "progress": 2
        },
        {
          "key": 88,
          "disabled": false,
          "href": "https://ant.design",
          "avatar": "https://gw.alipayobjects.com/zos/rmsportal/eeHMaZBwmTvLdIwMfBpg.png",
          "name": "TradeCode 88",
          "owner": "Kalash",
          "desc": "This is description",
          "callNo": 277,
          "status": "1",
          "updatedAt": "2022-12-06T05:00:57.040Z",
          "createdAt": "2022-12-06T05:00:57.040Z",
          "progress": 12
        },
        {
          "key": 87,
          "disabled": false,
          "href": "https://ant.design",
          "avatar": "https://gw.alipayobjects.com/zos/rmsportal/udxAbMEhpwthVVcjLXik.png",
          "name": "TradeCode 87",
          "owner": "Kalash",
          "desc": "This is description",
          "callNo": 810,
          "status": "1",
          "updatedAt": "2022-12-06T05:00:57.040Z",
          "createdAt": "2022-12-06T05:00:57.040Z",
          "progress": 82
        },
        {
          "key": 86,
          "disabled": false,
          "href": "https://ant.design",
          "avatar": "https://gw.alipayobjects.com/zos/rmsportal/eeHMaZBwmTvLdIwMfBpg.png",
          "name": "TradeCode 86",
          "owner": "Kalash",
          "desc": "This is description",
          "callNo": 780,
          "status": "3",
          "updatedAt": "2022-12-06T05:00:57.040Z",
          "createdAt": "2022-12-06T05:00:57.040Z",
          "progress": 22
        },
        {
          "key": 85,
          "disabled": false,
          "href": "https://ant.design",
          "avatar": "https://gw.alipayobjects.com/zos/rmsportal/udxAbMEhpwthVVcjLXik.png",
          "name": "TradeCode 85",
          "owner": "Kalash",
          "desc": "This is description",
          "callNo": 705,
          "status": "3",
          "updatedAt": "2022-12-06T05:00:57.040Z",
          "createdAt": "2022-12-06T05:00:57.040Z",
          "progress": 12
        },
        {
          "key": 84,
          "disabled": true,
          "href": "https://ant.design",
          "avatar": "https://gw.alipayobjects.com/zos/rmsportal/eeHMaZBwmTvLdIwMfBpg.png",
          "name": "TradeCode 84",
          "owner": "Kalash",
          "desc": "This is description",
          "callNo": 203,
          "status": "0",
          "updatedAt": "2022-12-06T05:00:57.040Z",
          "createdAt": "2022-12-06T05:00:57.040Z",
          "progress": 79
        },
        {
          "key": 83,
          "disabled": false,
          "href": "https://ant.design",
          "avatar": "https://gw.alipayobjects.com/zos/rmsportal/udxAbMEhpwthVVcjLXik.png",
          "name": "TradeCode 83",
          "owner": "Kalash",
          "desc": "This is description",
          "callNo": 491,
          "status": "2",
          "updatedAt": "2022-12-06T05:00:57.040Z",
          "createdAt": "2022-12-06T05:00:57.040Z",
          "progress": 59
        },
        {
          "key": 82,
          "disabled": false,
          "href": "https://ant.design",
          "avatar": "https://gw.alipayobjects.com/zos/rmsportal/eeHMaZBwmTvLdIwMfBpg.png",
          "name": "TradeCode 82",
          "owner": "Kalash",
          "desc": "This is description",
          "callNo": 73,
          "status": "0",
          "updatedAt": "2022-12-06T05:00:57.040Z",
          "createdAt": "2022-12-06T05:00:57.040Z",
          "progress": 100
        },
        {
          "key": 81,
          "disabled": false,
          "href": "https://ant.design",
          "avatar": "https://gw.alipayobjects.com/zos/rmsportal/udxAbMEhpwthVVcjLXik.png",
          "name": "TradeCode 81",
          "owner": "Kalash",
          "desc": "This is description",
          "callNo": 406,
          "status": "3",
          "updatedAt": "2022-12-06T05:00:57.040Z",
          "createdAt": "2022-12-06T05:00:57.040Z",
          "progress": 61
        },
        {
          "key": 80,
          "disabled": false,
          "href": "https://ant.design",
          "avatar": "https://gw.alipayobjects.com/zos/rmsportal/eeHMaZBwmTvLdIwMfBpg.png",
          "name": "TradeCode 80",
          "owner": "Kalash",
          "desc": "This is description",
          "callNo": 112,
          "status": "2",
          "updatedAt": "2022-12-06T05:00:57.040Z",
          "createdAt": "2022-12-06T05:00:57.040Z",
          "progress": 20
        }
      ],
      "total": 100,
      "success": true,
      "pageSize": 20,
      "current": 1
    },
    "query": {
      "token ": " 123",
      "current": "1",
      "pageSize": "20"
    },
    "payload": {},
    "types": "/** GET /api/rule */\nexport type GET_API_RULE_QUERY = {\n  /** example:  123 */\n        token : string;\n  /** example: 1 */\n        current: string;\n  /** example: 20 */\n        pageSize: string\n}\n  \n\nexport type GET_API_RULE_PAYLOAD = {\n  \n}\n  \n\nexport type GET_API_RULE_RES = {\n  /** example: [{\"key\": 99, \"disabled\": false, \"href\": \"https: //ant.design\", \"avatar\": \"https: //gw.alipayobjects.com/zos/rmsportal/udxAbMEhpwthVVcjLXik.png\", \"name\": \"TradeCode 99\", \"owner\": \"Kalash\", \"desc\": \"This is description\", \"callNo\": 503, \"status\": \"0\", \"updatedAt\": \"2022-12-06T05: 00: 57.040Z\", \"createdAt\": \"2022-12-06T05: 00: 57.040Z\", \"progress\": 81}, {\"key\": 98, \"disabled\": false, \"href\": \"https: //ant.design\", \"avatar\": \"https: //gw.alipayobjects.com/zos/rmsportal/eeHMaZBwmTvLdIwMfBpg.png\", \"name\": \"TradeCode 98\", \"owner\": \"Kalash\", \"desc\": \"This is Description\", \"callNo\": 164, \"status\": \"0\", \"updatedAt\": \"2022-12-06T05: 00: 57.040Z\", \"createdAt\": \"2022-12-06T05: 00: 57.040Z\", \"progress\": 12}, {\"key\": 97, \"disabled\": false, \"href\": \"https: //ant.design\", \"avatar\": \"https: //gw.alipayobjects.com/zos/rmsportal/udxAbMEhpwthVVcjLXik.png\", \"name\": \"TradeCode 97\", \"owner\": \"Kalash\", \"desc\": \"This is Description\", \"callNo\": 174, \"status\": \"1\", \"updatedAt\": \"2022-12-06T05: 00: 57.040Z\", \"createdAt\": \"2022-12-06T05: 00: 57.040Z\", \"progress\": 81}, {\"key\": 96, \"disabled\": true, \"href\": \"https: //ant.design\", \"avatar\": \"https: //gw.alipayobjects.com/zos/rmsportal/eeHMaZBwmTvLdIwMfBpg.png\", \"name\": \"TradeCode 96\", \"owner\": \"Kalash\", \"desc\": \"This is Description\", \"callNo\": 914, \"status\": \"0\", \"updatedAt\": \"2022-12-06T05: 00: 57.040Z\", \"createdAt\": \"2022-12-06T05: 00: 57.040Z\", \"progress\": 7}, {\"key\": 95, \"disabled\": false, \"href\": \"https: //ant.design\", \"avatar\": \"https: //gw.alipayobjects.com/zos/rmsportal/udxAbMEhpwthVVcjLXik.png\", \"name\": \"TradeCode 95\", \"owner\": \"Kalash\", \"desc\": \"This is Description\", \"callNo\": 698, \"status\": \"2\", \"updatedAt\": \"2022-12-06T05: 00: 57.040Z\", \"createdAt\": \"2022-12-06T05: 00: 57.040Z\", \"progress\": 82}, {\"key\": 94, \"disabled\": false, \"href\": \"https: //ant.design\", \"avatar\": \"https: //gw.alipayobjects.com/zos/rmsportal/eeHMaZBwmTvLdIwMfBpg.png\", \"name\": \"TradeCode 94\", \"owner\": \"Kalash\", \"desc\": \"This is Description\", \"callNo\": 488, \"status\": \"1\", \"updatedAt\": \"2022-12-06T05: 00: 57.040Z\", \"createdAt\": \"2022-12-06T05: 00: 57.040Z\", \"progress\": 14}, {\"key\": 93, \"disabled\": false, \"href\": \"https: //ant.design\", \"avatar\": \"https: //gw.alipayobjects.com/zos/rmsportal/udxAbMEhpwthVVcjLXik.png\", \"name\": \"TradeCode 93\", \"owner\": \"Kalash\", \"desc\": \"This is Description\", \"callNo\": 580, \"status\": \"2\", \"updatedAt\": \"2022-12-06T05: 00: 57.040Z\", \"createdAt\": \"2022-12-06T05: 00: 57.040Z\", \"progress\": 77}, {\"key\": 92, \"disabled\": false, \"href\": \"https: //ant.design\", \"avatar\": \"https: //gw.alipayobjects.com/zos/rmsportal/eeHMaZBwmTvLdIwMfBpg.png\", \"name\": \"TradeCode 92\", \"owner\": \"Kalash\", \"desc\": \"This is Description\", \"callNo\": 244, \"status\": \"3\", \"updatedAt\": \"2022-12-06T05: 00: 57.040Z\", \"createdAt\": \"2022-12-06T05: 00: 57.040Z\", \"progress\": 58}, {\"key\": 91, \"disabled\": false, \"href\": \"https: //ant.design\", \"avatar\": \"https: //gw.alipayobjects.com/zos/rmsportal/udxAbMEhpwthVVcjLXik.png\", \"name\": \"TradeCode 91\", \"owner\": \"Kalash\", \"desc\": \"This is Description\", \"callNo\": 959, \"status\": \"0\", \"updatedAt\": \"2022-12-06T05: 00: 57.040Z\", \"createdAt\": \"2022-12-06T05: 00: 57.040Z\", \"progress\": 66}, {\"key\": 90, \"disabled\": true, \"href\": \"https: //ant.design\", \"avatar\": \"https: //gw.alipayobjects.com/zos/rmsportal/eeHMaZBwmTvLdIwMfBpg.png\", \"name\": \"TradeCode 90\", \"owner\": \"Kalash\", \"desc\": \"This is Description\", \"callNo\": 958, \"status\": \"0\", \"updatedAt\": \"2022-12-06T05: 00: 57.040Z\", \"createdAt\": \"2022-12-06T05: 00: 57.040Z\", \"progress\": 72}, {\"key\": 89, \"disabled\": false, \"href\": \"https: //ant.design\", \"avatar\": \"https: //gw.alipayobjects.com/zos/rmsportal/udxAbMEhpwthVVcjLXik.png\", \"name\": \"TradeCode 89\", \"owner\": \"Kalash\", \"desc\": \"This is Description\", \"callNo\": 301, \"status\": \"2\", \"updatedAt\": \"2022-12-06T05: 00: 57.040Z\", \"createdAt\": \"2022-12-06T05: 00: 57.040Z\", \"progress\": 2}, {\"key\": 88, \"disabled\": false, \"href\": \"https: //ant.design\", \"avatar\": \"https: //gw.alipayobjects.com/zos/rmsportal/eeHMaZBwmTvLdIwMfBpg.png\", \"name\": \"TradeCode 88\", \"owner\": \"Kalash\", \"desc\": \"This is Description\", \"callNo\": 277, \"status\": \"1\", \"updatedAt\": \"2022-12-06T05: 00: 57.040Z\", \"createdAt\": \"2022-12-06T05: 00: 57.040Z\", \"progress\": 12}, {\"key\": 87, \"disabled\": false, \"href\": \"https: //ant.design\", \"avatar\": \"https: //gw.alipayobjects.com/zos/rmsportal/udxAbMEhpwthVVcjLXik.png\", \"name\": \"TradeCode 87\", \"owner\": \"Kalash\", \"desc\": \"This is Description\", \"callNo\": 810, \"status\": \"1\", \"updatedAt\": \"2022-12-06T05: 00: 57.040Z\", \"createdAt\": \"2022-12-06T05: 00: 57.040Z\", \"progress\": 82}, {\"key\": 86, \"disabled\": false, \"href\": \"https: //ant.design\", \"avatar\": \"https: //gw.alipayobjects.com/zos/rmsportal/eeHMaZBwmTvLdIwMfBpg.png\", \"name\": \"TradeCode 86\", \"owner\": \"Kalash\", \"desc\": \"This is Description\", \"callNo\": 780, \"status\": \"3\", \"updatedAt\": \"2022-12-06T05: 00: 57.040Z\", \"createdAt\": \"2022-12-06T05: 00: 57.040Z\", \"progress\": 22}, {\"key\": 85, \"disabled\": false, \"href\": \"https: //ant.design\", \"avatar\": \"https: //gw.alipayobjects.com/zos/rmsportal/udxAbMEhpwthVVcjLXik.png\", \"name\": \"TradeCode 85\", \"owner\": \"Kalash\", \"desc\": \"This is Description\", \"callNo\": 705, \"status\": \"3\", \"updatedAt\": \"2022-12-06T05: 00: 57.040Z\", \"createdAt\": \"2022-12-06T05: 00: 57.040Z\", \"progress\": 12}, {\"key\": 84, \"disabled\": true, \"href\": \"https: //ant.design\", \"avatar\": \"https: //gw.alipayobjects.com/zos/rmsportal/eeHMaZBwmTvLdIwMfBpg.png\", \"name\": \"TradeCode 84\", \"owner\": \"Kalash\", \"desc\": \"This is Description\", \"callNo\": 203, \"status\": \"0\", \"updatedAt\": \"2022-12-06T05: 00: 57.040Z\", \"createdAt\": \"2022-12-06T05: 00: 57.040Z\", \"progress\": 79}, {\"key\": 83, \"disabled\": false, \"href\": \"https: //ant.design\", \"avatar\": \"https: //gw.alipayobjects.com/zos/rmsportal/udxAbMEhpwthVVcjLXik.png\", \"name\": \"TradeCode 83\", \"owner\": \"Kalash\", \"desc\": \"This is Description\", \"callNo\": 491, \"status\": \"2\", \"updatedAt\": \"2022-12-06T05: 00: 57.040Z\", \"createdAt\": \"2022-12-06T05: 00: 57.040Z\", \"progress\": 59}, {\"key\": 82, \"disabled\": false, \"href\": \"https: //ant.design\", \"avatar\": \"https: //gw.alipayobjects.com/zos/rmsportal/eeHMaZBwmTvLdIwMfBpg.png\", \"name\": \"TradeCode 82\", \"owner\": \"Kalash\", \"desc\": \"This is Description\", \"callNo\": 73, \"status\": \"0\", \"updatedAt\": \"2022-12-06T05: 00: 57.040Z\", \"createdAt\": \"2022-12-06T05: 00: 57.040Z\", \"progress\": 100}, {\"key\": 81, \"disabled\": false, \"href\": \"https: //ant.design\", \"avatar\": \"https: //gw.alipayobjects.com/zos/rmsportal/udxAbMEhpwthVVcjLXik.png\", \"name\": \"TradeCode 81\", \"owner\": \"Kalash\", \"desc\": \"This is Description\", \"callNo\": 406, \"status\": \"3\", \"updatedAt\": \"2022-12-06T05: 00: 57.040Z\", \"createdAt\": \"2022-12-06T05: 00: 57.040Z\", \"progress\": 61}, {\"key\": 80, \"disabled\": false, \"href\": \"https: //ant.design\", \"avatar\": \"https: //gw.alipayobjects.com/zos/rmsportal/eeHMaZBwmTvLdIwMfBpg.png\", \"name\": \"TradeCode 80\", \"owner\": \"Kalash\", \"desc\": \"This is Description\", \"callNo\": 112, \"status\": \"2\", \"updatedAt\": \"2022-12-06T05: 00: 57.040Z\", \"createdAt\": \"2022-12-06T05: 00: 57.040Z\", \"progress\": 20}] */\n        data: {\n      key: number,\ndisabled: boolean,\nhref: string,\navatar: string,\nname: string,\nowner: string,\ndesc: string,\ncallNo: number,\nstatus: string,\nupdatedAt: string,\ncreatedAt: string,\nprogress: number\n      }[];\n  /** example: 100 */\n        total: number;\n  /** example: true */\n        success: boolean;\n  /** example: 20 */\n        pageSize: number;\n  /** example: 1 */\n        current: number\n}\n  "
  },
  "POST /api/login/outLogin": {
    "res": {
      "data": {},
      "success": true
    },
    "query": {
      "token ": " 123"
    },
    "payload": {},
    "types": "/** POST /api/login/outLogin */\nexport type POST_API_LOGIN_OUT_LOGIN_QUERY = {\n  /** example:  123 */\n        token : string\n}\n  \n\nexport type POST_API_LOGIN_OUT_LOGIN_PAYLOAD = {\n  \n}\n  \n\nexport type POST_API_LOGIN_OUT_LOGIN_RES = {\n  /** example: {} */\n        data: {\n      \n      };\n  /** example: true */\n        success: boolean\n}\n  "
  },
  "POST /api/login/account": {
    "res": {
      "status": "ok",
      "type": "account",
      "currentAuthority": "admin"
    },
    "query": {
      "token ": " 123"
    },
    "payload": {
      "username": "admin",
      "password": "ant.design",
      "autoLogin": true,
      "type": "account"
    },
    "types": "/** POST /api/login/account */\nexport type POST_API_LOGIN_ACCOUNT_QUERY = {\n  /** example:  123 */\n        token : string\n}\n  \n\nexport type POST_API_LOGIN_ACCOUNT_PAYLOAD = {\n  /** example: admin */\n        username: string;\n  /** example: ant.design */\n        password: string;\n  /** example: true */\n        autoLogin: boolean;\n  /** example: account */\n        type: string\n}\n  \n\nexport type POST_API_LOGIN_ACCOUNT_RES = {\n  /** example: ok */\n        status: string;\n  /** example: account */\n        type: string;\n  /** example: admin */\n        currentAuthority: string\n}\n  "
  }
}
